{
  "project_id": "proj_demo",
  "seed": 0,
  "strategy": "skyline",
  "kerf_mm": 1.0,
  "grain_rule": "strict",
  "parts": [
    {
      "part_id": "proj_demo::panel_side_a",
      "length_mm": 762,
      "width_mm": 381,
      "quantity": 2,
      "allow_rotation": false
    }
  ],
  "stock": [
    {
      "sheet_id": "sheet-1",
      "length_mm": 2440,
      "width_mm": 1220,
      "quantity": 1
    }
  ]
}
